{
    "version": "1.0",
    "targetFile": "template.ai",
    "operations": [
        {
            "id": "op_resize_1",
            "type": "resize",
            "target": "Rectangle",
            "parameters": {
                "width": { "value": 150, "unit": "mm", "action": "set" },
                "height": { "value": 150, "unit": "mm", "action": "set" }
            }
        },
        {
            "id": "op_move_1",
            "type": "move",
            "target": "Rectangle",
            "parameters": {
                "x": { "value": 50, "unit": "mm", "action": "increase" },
                "y": { "value": -20, "unit": "mm", "action": "increase" },
                "mode": "relative"
            },
            "dependencies": ["op_resize_1"]
        }
    ],
    "metadata": {
        "description": "Test basic operations: Resize and Move on 'Rectangle' object"
    }
}